{
  "meta": {
    "featureId": "feature-011-preworkout-website",
    "title": "Technische Analyse - Pre-workout Webshop",
    "version": "1.0.0"
  },
  "scope": {
    "inScope": [
      "Full stack webshop voor pre-workout supplementen",
      "Figma-level UI designs",
      "UML diagrams",
      "database ERD",
      "API contracten",
      "Productcatalogus module",
      "Productdetail module",
      "Winkelmand module",
      "Checkout module",
      "Betaling module",
      "Account module",
      "Admin dashboard module",
      "Orderbeheer module",
      "API-laag"
    ],
    "outOfScope": [
      "Specifieke implementatiedetails van de betalingsprovider",
      "Gedetailleerde marketingstrategie\u00ebn",
      "Fysieke distributie van producten"
    ]
  },
  "assumptions": [
    "Wat is de exacte definitie van 'normale belasting' voor de laadtijd van het productoverzicht?",
    "Welke specifieke betaalmethoden naast Bancontact en Creditcard worden ondersteund?",
    "Hoe wordt omgegaan met het annuleren van een bestelling na het plaatsen ervan maar voor betaling?",
    "Zijn er specifieke vereisten voor de beveiliging van de API-laag buiten de genoemde authenticatie en autorisatie?",
    "Wat zijn de criteria voor het bepalen van de 'voorraadstatus' die getoond wordt op de productkaart?"
  ],
  "openQuestions": [
    "Wat is de exacte definitie van 'normale belasting' voor de laadtijd van het productoverzicht?",
    "Welke specifieke betaalmethoden naast Bancontact en Creditcard worden ondersteund?",
    "Hoe wordt omgegaan met het annuleren van een bestelling na het plaatsen ervan maar voor betaling?",
    "Zijn er specifieke vereisten voor de beveiliging van de API-laag buiten de genoemde authenticatie en autorisatie?",
    "Wat zijn de criteria voor het bepalen van de 'voorraadstatus' die getoond wordt op de productkaart?"
  ],
  "requirements": [
    {
      "id": "REQ-001",
      "text": "Klanten moeten pre-workout producten kunnen zoeken, filteren, bekijken, toevoegen aan hun winkelmand, afrekenen en hun bestelgeschiedenis opvolgen.",
      "priority": "must"
    },
    {
      "id": "REQ-002",
      "text": "Admins moeten producten, voorraad en bestellingen kunnen beheren.",
      "priority": "must"
    },
    {
      "id": "REQ-003",
      "text": "De applicatie moet een duidelijke productcard stijl gebruiken met sterke CTA-knoppen.",
      "priority": "should"
    },
    {
      "id": "REQ-004",
      "text": "De checkout moet een overzicht van de bestelling en een order summary bevatten.",
      "priority": "must"
    },
    {
      "id": "REQ-005",
      "text": "De homepage moet een hero sectie bevatten met een titel, ondertitel, call-to-action knoppen en een afbeelding.",
      "priority": "should"
    },
    {
      "id": "REQ-006",
      "text": "De productdetailpagina moet productinformatie tonen zoals afbeelding, titel, beschrijving, opties (cafe\u00efne, servings, smaak, voorraad), prijs en actieknoppen (toevoegen, favoriet).",
      "priority": "must"
    },
    {
      "id": "REQ-007",
      "text": "De checkout sectie moet invoervelden bevatten voor verzendgegevens (voornaam, achternaam, straat + nr, postcode, gemeente, e-mail) en opties voor betaalmethoden (Bancontact, Creditcard).",
      "priority": "must"
    },
    {
      "id": "REQ-008",
      "text": "De order summary sectie moet een overzicht tonen van bestelde items (naam, aantal, prijs) en de totale prijs.",
      "priority": "must"
    },
    {
      "id": "REQ-009",
      "text": "De applicatie moet een responsive design hebben dat werkt op desktop, tablet en mobiel.",
      "priority": "must"
    },
    {
      "id": "REQ-010",
      "text": "Het productoverzicht moet binnen 2 seconden laden bij normale belasting.",
      "priority": "should"
    },
    {
      "id": "REQ-011",
      "text": "Wachtwoorden moeten gehasht worden opgeslagen.",
      "priority": "must"
    }
  ],
  "domain": {
    "entities": [
      {
        "name": "User",
        "fields": [
          {
            "name": "id",
            "type": "UUID",
            "constraints": [
              "notNull"
            ],
            "testCases": [
              "missing"
            ]
          },
          {
            "name": "firstName",
            "type": "String",
            "constraints": [
              "notNull",
              "minLength:1",
              "maxLength:255"
            ],
            "testCases": [
              "empty",
              "too_long",
              "missing"
            ]
          },
          {
            "name": "lastName",
            "type": "String",
            "constraints": [
              "notNull",
              "minLength:1",
              "maxLength:255"
            ],
            "testCases": [
              "empty",
              "too_long",
              "missing"
            ]
          },
          {
            "name": "email",
            "type": "String",
            "constraints": [
              "notNull",
              "maxLength:255"
            ],
            "testCases": [
              "empty",
              "too_long",
              "missing",
              "invalid_value",
              "duplicate_per_day"
            ]
          },
          {
            "name": "passwordHash",
            "type": "String",
            "constraints": [
              "notNull",
              "minLength:60",
              "maxLength:60"
            ],
            "testCases": [
              "empty",
              "too_short",
              "too_long",
              "missing"
            ]
          },
          {
            "name": "role",
            "type": "Role",
            "constraints": [
              "notNull"
            ],
            "testCases": [
              "missing",
              "invalid_value"
            ]
          },
          {
            "name": "createdAt",
            "type": "LocalDateTime",
            "constraints": [
              "notNull"
            ],
            "testCases": [
              "missing"
            ]
          },
          {
            "name": "updatedAt",
            "type": "LocalDateTime",
            "constraints": [
              "notNull"
            ],
            "testCases": [
              "missing"
            ]
          }
        ]
      },
      {
        "name": "CartItem",
        "fields": [
          {
            "name": "id",
            "type": "UUID",
            "constraints": [
              "notNull"
            ],
            "testCases": [
              "missing"
            ]
          },
          {
            "name": "userId",
            "type": "UUID",
            "constraints": [
              "notNull"
            ],
            "testCases": [
              "missing",
              "invalid_value"
            ]
          },
          {
            "name": "productId",
            "type": "UUID",
            "constraints": [
              "notNull"
            ],
            "testCases": [
              "missing",
              "invalid_value"
            ]
          },
          {
            "name": "quantity",
            "type": "Integer",
            "constraints": [
              "notNull",
              "minLength:1"
            ],
            "testCases": [
              "empty",
              "too_short",
              "missing",
              "invalid_value"
            ]
          },
          {
            "name": "createdAt",
            "type": "LocalDateTime",
            "constraints": [
              "notNull"
            ],
            "testCases": [
              "missing"
            ]
          },
          {
            "name": "updatedAt",
            "type": "LocalDateTime",
            "constraints": [
              "notNull"
            ],
            "testCases": [
              "missing"
            ]
          }
        ]
      },
      {
        "name": "Product",
        "fields": [
          {
            "name": "id",
            "type": "UUID",
            "constraints": [
              "notNull"
            ],
            "testCases": [
              "missing"
            ]
          },
          {
            "name": "name",
            "type": "String",
            "constraints": [
              "notNull",
              "minLength:1",
              "maxLength:255"
            ],
            "testCases": [
              "empty",
              "too_long",
              "missing"
            ]
          },
          {
            "name": "description",
            "type": "String",
            "constraints": [
              "notNull",
              "minLength:1"
            ],
            "testCases": [
              "empty",
              "too_long",
              "missing"
            ]
          },
          {
            "name": "price",
            "type": "BigDecimal",
            "constraints": [
              "notNull",
              "minLength:0"
            ],
            "testCases": [
              "empty",
              "too_short",
              "missing",
              "invalid_value"
            ]
          },
          {
            "name": "flavor",
            "type": "String",
            "constraints": [
              "maxLength:255"
            ],
            "testCases": [
              "too_long",
              "invalid_value"
            ]
          },
          {
            "name": "caffeineMg",
            "type": "Integer",
            "constraints": [
              "minLength:0"
            ],
            "testCases": [
              "too_short",
              "invalid_value"
            ]
          },
          {
            "name": "servings",
            "type": "Integer",
            "constraints": [
              "minLength:1"
            ],
            "testCases": [
              "too_short",
              "invalid_value"
            ]
          },
          {
            "name": "stock",
            "type": "Integer",